SYM,TIME,LINK,TITLE
FPT,T260721_0819,https://fireant.vn/dashboard/content/news/41010452,Khuyến nghị cổ phiếu tiềm năng từ MBS và BSC năm 2026
DBC,T260721_0646,https://fireant.vn/dashboard/content/news/41009822,DBC: Khẩn trương điều tra vụ tai nạn lao động đặc biệt nghiêm trọng ở Thanh Hóa
NVL,T260721_0644,https://fireant.vn/dashboard/content/news/41009807,NVL: Novaland cam kết tháo gỡ vướng mắc để cấp 9.000 sổ hồng cho cư dân
DBC,T260721_0606,https://fireant.vn/dashboard/content/news/41009714,DBC: Dabaco Việt Nam hỗ trợ 13 nạn nhân bị ngạt khí độc tại trại nuôi heo ở Thanh Hóa
VDS,T260720_2230,https://fireant.vn/dashboard/content/news/41009137,VDS: Chứng khoán Rồng Việt: Doanh thu quý II/2026 tăng 46%
GVR,T260720_2211,https://fireant.vn/dashboard/content/news/41009005,"CTCK điểm tên 7 cổ phiếu đầu ngành đã rơi về vùng ""quá bán"" sau nhịp chiết khấu sâu"
HHV,T260720_1903,https://fireant.vn/dashboard/content/news/41007194,Đèo Cả còn chưa đầy 180 ngày để hoàn thành dự án kết nối sân bay 16 tỷ USD
PC1,T260720_1829,https://fireant.vn/dashboard/content/news/41006821,Chủ tịch Nguyễn Như Hoàng Tuấn bị bắt; doanh nghiệp ra loạt thông báo quan trọng
VCI,T260720_1806,https://fireant.vn/dashboard/content/news/41006609,VCI: Giải trình biến động LNST trên BCTC quý 2/2026 so với cùng kỳ năm trước
TCM,T260720_1802,https://fireant.vn/dashboard/content/news/41006604,TCM: Thông báo giao dịch cổ phiếu của người nội bộ Nguyễn Văn Nghĩa
FPT,T260720_1735,https://fireant.vn/dashboard/content/news/41006292,FPT: Giấy chứng nhận đăng ký doanh nghiệp thay đổi lần thứ 61
BVS,T260720_1700,https://fireant.vn/dashboard/content/news/41005936,BVS: Báo cáo tài chính quý 2/2026
CMG,T260720_1612,https://fireant.vn/dashboard/content/news/41005195,CMG: Báo cáo thường niên năm 2025
NHA,T260720_1611,https://fireant.vn/dashboard/content/news/41005196,NHA: Giải trình chênh lệch LNST BCTC Quý 2 năm 2026
VCI,T260720_1605,https://fireant.vn/dashboard/content/news/41005148,Lộ diện công ty chứng khoán lỗ gần 100 tỷ trong quý 2/2026
FPT,T260720_1510,https://fireant.vn/dashboard/content/news/41004204,Một công ty chứng khoán báo lãi gấp 2;5 lần; dư nợ margin gần 11.700 tỷ đồng
KDH,T260720_1505,https://fireant.vn/dashboard/content/news/41004157,KDH: Ông Lý Tuấn Kiệt; con trai ông Lý Điền Sơn Phó Chủ tịch HĐQT đăng ký mua vào 20 triệu cổ phiếu KDH
BCM,T260720_1421,https://fireant.vn/dashboard/content/news/41001386,BCM: Thông báo giấy xác nhận thay đổi nội dung ĐKDN
DBC,T260720_1420,https://fireant.vn/dashboard/content/news/41001709,"DBC: Dabaco ""bốc hơi"" hơn 280 tỷ đồng vốn hóa sau vụ tai nạn tại trang trại Thanh Hóa"
NVL,T260720_1405,https://fireant.vn/dashboard/content/news/41000084,NVL: Novaland dự kiến phát hành hơn 800 triệu cổ phiếu giá 10.000 đồng/cp cho cổ đông để trả nợ
BSI,T260720_1320,https://fireant.vn/dashboard/content/news/40998379,"Cập nhật số liệu CTCK chiều 20/7: Sát ""deadline""; Chứng khoán VPS; BSC; KB Việt Nam đồng loạt báo lãi quý 2 tăng mạnh"
NVL,T260720_1101,https://fireant.vn/dashboard/content/news/40992083,NVL: Novaland muốn cho hai công ty con vay hơn 2.000 tỷ đồng để làm gì?
IDC,T260720_0919,https://fireant.vn/dashboard/content/news/40986754,Gần 30 doanh nghiệp sắp chốt quyền cổ tức; hai ngân hàng dự chi lớn
VDS,T260720_0857,https://fireant.vn/dashboard/content/news/40985429,"Lợi nhuận ngành chứng khoán phân hóa mạnh: Có công ty lãi hơn 2.000 tỷ; nhiều ""tên tuổi"" giảm tới 95%"
NKG,T260720_0839,https://fireant.vn/dashboard/content/news/40985268,Thép ray trải đường cho tăng trưởng; doanh nghiệp nào hưởng lợi?
CMG,T260720_0659,https://fireant.vn/dashboard/content/news/40984923,Doanh nghiệp hiến kế thúc đẩy tăng trưởng hai con số
CTS,T260720_0004,https://fireant.vn/dashboard/content/news/40984740,Nhiều công ty chứng khoán báo lợi nhuận quý II/2026 giảm mạnh
VCI,T260719_2356,https://fireant.vn/dashboard/content/news/40984730,Chứng khoán tuần mới (20/7-25/7): Thanh khoản rơi xuống vùng thấp; dòng tiền đợi chờ tín hiệu mới
DGC,T260719_2301,https://fireant.vn/dashboard/content/news/40984648,"Ôm loạt ""cổ phiếu quốc dân"" FPT; HPG; MWG; SSI... vẫn lỗ nặng: Nhà đầu tư nên làm gì?"
HHV,T260719_2221,https://fireant.vn/dashboard/content/news/40984542,MBS gọi tên 2 doanh kỳ vọng hưởng lợi nhờ chu kỳ đầu tư công 2026–2030
VDS,T260719_1115,https://fireant.vn/dashboard/content/news/40982640,VDS: Chứng khoán Rồng Việt sắp phát hành 500 tỷ đồng trái phiếu
NLG,T260719_0859,https://fireant.vn/dashboard/content/news/40982115,Sếp doanh nghiệp và người nhà 'đua' bắt đáy cổ phiếu
VGC,T260719_0844,https://fireant.vn/dashboard/content/news/40982063,VGC: Viglacera bổ nhiệm thêm một Phó Tổng giám đốc
DXG,T260718_2225,https://fireant.vn/dashboard/content/news/40981602,DXG: Dragon Capital rời ghế cổ đông lớn tại Bluemarq Group
HHV,T260718_1438,https://fireant.vn/dashboard/content/news/40980040,Vietcombank; Vietinbank; BIDV; Agribank; VPBank; TPBank rót hơn 27.000 tỷ cho vay dự án do Tập đoàn Đèo Cả; Tasco; CII làm chủ đầu tư
HDG,T260718_0944,https://fireant.vn/dashboard/content/news/40978704,Điện tiêu thụ lập đỉnh; doanh nghiệp thủy điện vẫn ghi nhận bức tranh trái chiều
BVS,T260717_2348,https://fireant.vn/dashboard/content/news/40977899,Cập nhật BCTC quý 2/2026 ngày 18/7: VPBank; TPBank cùng hàng loạt doanh nghiệp công bố; nhiều doanh nghiệp tăng hàng nghìn %
CTS,T260717_2124,https://fireant.vn/dashboard/content/news/40977239,CTS: Một công ty chứng khoán báo lãi quý II “lao dốc” 91%; chạm đáy hơn 3 năm dù dư nợ margin lập đỉnh
PDR,T260717_1917,https://fireant.vn/dashboard/content/news/40976450,"Một cổ phiếu ngân hàng bị tự doanh CTCK ""xả"" mạnh phiên cuối tuần"
NLG,T260717_1830,https://fireant.vn/dashboard/content/news/40976107,Khối ngoại mạnh tay gom thêm cổ phiếu Vinamilk giữa nhịp điều chỉnh
PC1,T260717_1829,https://fireant.vn/dashboard/content/news/40976094,PC1: Báo cáo về ngày trở thành cổ đông lớn Công ty TNHH Thương mại Đầu tư CII
DXG,T260717_1828,https://fireant.vn/dashboard/content/news/40976095,DXG: Báo cáo về thay đổi sở hữu của nhóm nhà ĐTN có liên quan là CĐ lớn
FTS,T260717_1824,https://fireant.vn/dashboard/content/news/40976045,Nhóm công ty chứng khoán nhỏ bất ngờ bứt phá lợi nhuận
HDG,T260717_1815,https://fireant.vn/dashboard/content/news/40975955,Điện tiêu thụ lập đỉnh; doanh nghiệp thủy điện vẫn ghi nhận bức tranh trái chiều
BSI,T260717_1750,https://fireant.vn/dashboard/content/news/40975815,BSI: Nghị quyết HĐQT thông qua kế hoạch tổ chức lấy ý kiến cổ đông bằng văn bản
VGC,T260717_1746,https://fireant.vn/dashboard/content/news/40975737,VGC: Thông báo thay đổi nhân sự - Bổ nhiệm PTGĐ
KDH,T260717_1730,https://fireant.vn/dashboard/content/news/40975602,KDH: Thông báo ký hợp đồng kiểm toán BCTC 2026
PDR,T260717_1321,https://fireant.vn/dashboard/content/news/40968053,PDR: Phát Đạt sử dụng vốn đợt chào bán cổ phiếu để trả lương nhân viên và các khoản nợ
VGC,T260717_0931,https://fireant.vn/dashboard/content/news/40960037,VGC: Viglacera hoàn tất chuyển quyền sở hữu cổ phần tại PFG
DGC,T260717_0925,https://fireant.vn/dashboard/content/news/40959583,DGC: Hóa chất Đức Giang lùi tiến độ siêu dự án 12.000 tỷ; lý do là gì?
GVR,T260717_0646,https://fireant.vn/dashboard/content/news/40957546,VRG đề xuất đầu tư chuỗi dự án gần 42.000 tỷ đồng tại Lâm Đồng
DGC,T260716_1737,https://fireant.vn/dashboard/content/news/40954670,"DGC: Nghị quyết HĐQT về việc thông qua nội dung đề nghị điều chỉnh GCNĐK đầu tư ""Dự án số 1; Tổ hợp hóa chất Đức Giang Nghi Sơn"""
GVR,T260716_1641,https://fireant.vn/dashboard/content/news/40954077,Sau khi Sun Group; Novaland; T&T Group... đổ bộ; thêm một ông lớn muốn đầu tư chuỗi dự án gần 42.000 tỷ đồng tại tỉnh rộng nhất Việt Nam
SSB,T260716_1116,https://fireant.vn/dashboard/content/news/40940408,OPEC Fund cấp vốn 50 triệu USD cho SeABank; thúc đẩy tài trợ doanh nghiệp nhỏ và tài chính khí hậu tại Việt Nam
BVS,T260716_1039,https://fireant.vn/dashboard/content/news/40938289,BVS: Thay đổi giấy đăng ký kinh doanh
MSN,T260716_0856,https://fireant.vn/dashboard/content/news/40931604,MCH: Liên tiếp ghi dấu trên thị trường vốn; gia nhập VN30; mở rộng khả năng thu hút dòng tiền tổ chức
NLG,T260715_1722,https://fireant.vn/dashboard/content/news/40927354,NLG: Thông báo giao dịch cổ phiếu của người có liên quan đến người nội bộ Nguyễn Hiệp
NKG,T260715_1549,https://fireant.vn/dashboard/content/news/40926064,NKG: Nghị quyết HĐQT số 11/2026 ngày 15/07/2026 và Điều lệ Công ty sửa đổi lần thứ 28
SSB,T260715_1547,https://fireant.vn/dashboard/content/news/40926065,SSB: Nghị quyết HĐQT thông qua việc gia hạn Hợp đồng thuê văn phòng làm việc Khối Xử lý nợ
PVP,T260715_1320,https://fireant.vn/dashboard/content/news/40918959,PVP: Thông báo thay đổi nhân sự
IDC,T260715_1212,https://fireant.vn/dashboard/content/news/40917009,Một chi nhánh của Idico vừa bị xử phạt và truy thu thuế
BSI,T260714_1737,https://fireant.vn/dashboard/content/news/40905579,BSI: Thông báo về việc niêm yết và giao dịch chứng khoán thay đổi niêm yết
PVP,T260714_1642,https://fireant.vn/dashboard/content/news/40905116,Một nhóm cổ phiếu bất ngờ nổi sóng; có mã tăng kịch trần
SSB,T260714_1353,https://fireant.vn/dashboard/content/news/40900546,SSB: Báo cáo kết quả giao dịch cổ phiếu của người nội bộ Nguyễn Hồng Quang
HDC,T260714_1352,https://fireant.vn/dashboard/content/news/40900547,HDC: Thông báo về việc giao dịch chứng khoán thay đổi đăng ký niêm yết
CMG,T260714_1225,https://fireant.vn/dashboard/content/news/40897234,CMG: Lên kế hoạch tăng trưởng; tập trung phát triển hạ tầng số
BCM,T260714_0907,https://fireant.vn/dashboard/content/news/40888988,Danh mục đáng chú ý: Mua ELC; tích lũy BCM; KBC và IDC
TCM,T260713_1800,https://fireant.vn/dashboard/content/news/40885305,TCM: Nhận được Quyết định về việc xử phạt vi phạm hành chính về thuế
PVP,T260713_1628,https://fireant.vn/dashboard/content/news/40884330,PVP: Giấy chứng nhận đăng ký doanh nghiệp thay đổi lần thứ 12
PDR,T260713_1626,https://fireant.vn/dashboard/content/news/40884332,PDR: Quyết định của HĐQT số 30/2026 ngày 13/07/2026
HCM,T260713_0957,https://fireant.vn/dashboard/content/news/40869280,"Công ty chứng khoán chạy đua tăng vốn; chuẩn bị cho ""sân chơi"" mới"
HCM,T260713_0905,https://fireant.vn/dashboard/content/news/40866472,Lịch chốt quyền trả cổ tức trong tuần từ ngày 13/7-17/7; tỷ lệ cao nhất 50%
TCM,T260713_0809,https://fireant.vn/dashboard/content/news/40865937,Vinatex; TNG tăng trưởng tích cực; doanh nghiệp dệt may vẫn đối mặt áp lực
DXG,T260712_2257,https://fireant.vn/dashboard/content/news/40865493,MBS gọi tên 3 doanh nghiệp BĐS hưởng lợi nhờ phát triển hạ tầng và loạt dự án lớn
HCM,T260711_2247,https://fireant.vn/dashboard/content/news/40863023,Lịch chốt quyền cổ tức 13-17/7: Cổ tức tiền mặt cao nhất 50%; một ngân hàng lớn sắp chi hơn 3.000 tỷ đồng
KDH,T260711_1513,https://fireant.vn/dashboard/content/news/40861547,Lợi nhuận nhóm bất động sản dân cư: Doanh nghiệp nào khởi sắc?
DIG,T260711_1105,https://fireant.vn/dashboard/content/news/40860656,DIG: Chủ tịch DIC Corp cùng người thân tiếp tục bị bán giải chấp cổ phiếu DIG
HDG,T260711_0845,https://fireant.vn/dashboard/content/news/40860084,Cổ phiếu nào hưởng lợi từ thị trường carbon?
SZC,T260710_1819,https://fireant.vn/dashboard/content/news/40857920,SZC: Báo cáo kết quả giao dịch cổ phiếu của người nội bộ Phạm Anh Tuấn
NKG,T260710_1814,https://fireant.vn/dashboard/content/news/40857842,NKG: Giấy chứng nhận đăng ký doanh nghiệp thay đổi lần thứ 33
NHA,T260710_1800,https://fireant.vn/dashboard/content/news/40857748,NHA: Thông báo về ngày đăng ký cuối cùng trả cổ tức năm 2025 bằng cổ phiếu
DIG,T260710_1733,https://fireant.vn/dashboard/content/news/40857515,DIG: Báo cáo kết quả giao dịch cổ phiếu của người có liên quan đến Người nội bộ Lê Thị Hà Thành
DIG,T260710_1733,https://fireant.vn/dashboard/content/news/40857514,DIG: Báo cáo kết quả giao dịch cổ phiếu của Người nội bộ Nguyễn Thị Thanh Huyền; Nguyễn Hùng Cường
HDC,T260710_1349,https://fireant.vn/dashboard/content/news/40851216,HDC: Quyết định thay đổi đăng ký niêm yết
EIB,T260710_1206,https://fireant.vn/dashboard/content/news/40847486,"Cơ hội giải ngân ""cổ phiếu vua"""
FTS,T260709_1817,https://fireant.vn/dashboard/content/news/40835404,FTS: Giấy chứng nhận đăng ký doanh nghiệp thay đổi lần thứ 8
HDC,T260709_1814,https://fireant.vn/dashboard/content/news/40835411,HDC: Giấy chứng nhận đăng ký doanh nghiệp thay đổi lần thứ 34
HT1,T260709_1712,https://fireant.vn/dashboard/content/news/40834996,HT1: Quyết định của HĐQT về việc chấp thuận chủ trương giao dịch với Công ty Cổ phần Logistics VICEM
BCM,T260707_1902,https://fireant.vn/dashboard/content/news/40794946,BCM: Becamex rót gần 695 tỷ đồng lập công ty con tại Khánh Hòa
HT1,T260707_1411,https://fireant.vn/dashboard/content/news/40789741,HT1: Thông báo ký hợp đồng kiểm toán BCTC 2026
HT1,T260707_0002,https://fireant.vn/dashboard/content/news/40775786,Vietcap dự báo VN-Index có cơ hội trở lại đỉnh cũ; gọi tên 4 cổ phiếu tiềm năng
EIB,T260706_1747,https://fireant.vn/dashboard/content/news/40773151,Hai ngân hàng chuẩn bị họp cổ đông bất thường bàn vấn đề nhân sự
NHA,T260706_1335,https://fireant.vn/dashboard/content/news/40764912,NHA: Nghị quyết HĐQT số 10 ngày 03/07/2026
EIB,T260705_1816,https://fireant.vn/dashboard/content/news/40753413,Eximbank chuẩn bị họp ĐHCĐ bất thường: Thay loạt thành viên HĐQT; yêu cầu không truyền tin ra ngoài cho đến khi có kết luận cuộc họp
FTS,T260705_1106,https://fireant.vn/dashboard/content/news/40752507,Cổ phiếu chứng khoán hút dòng tiền: Định giá về vùng hấp dẫn; lực kéo từ thanh khoản tỷ USD
SZC,T260703_1003,https://fireant.vn/dashboard/content/news/40732554,Trong chu kỳ phát triển mới; doanh nghiệp bất động sản khu công nghiệp làm ăn ra sao?
SZC,T260701_0923,https://fireant.vn/dashboard/content/news/40695049,Ngành nào sẽ dẫn dắt tăng trưởng lợi nhuận quý II?
IJC,T260629_1629,https://fireant.vn/dashboard/content/news/40673191,IJC: Nghị quyết HĐQT số 28 ngày 26/06/2026
IJC,T260629_1442,https://fireant.vn/dashboard/content/news/40671515,IJC: Duyệt dự án chung cư 2.328 tỷ đồng; kỳ vọng thu về gần 443 tỷ đồng lợi nhuận
IJC,T260622_1334,https://fireant.vn/dashboard/content/news/40561503,IJC: Nghị quyết HĐQT số 26 ngày 18/06/2026
