SYM,TIME,LINK,TITLE
DBC,T260713_1527,https://fireant.vn/dashboard/content/news/40883381,DBC: Thông báo giao dịch cổ phiếu của người có liên quan đến người nội bộ Nguyễn Văn Vượng
SSB,T260713_1341,https://fireant.vn/dashboard/content/news/40877685,OPEC Fund cấp vốn 50 triệu USD cho SeABank; thúc đẩy tài trợ doanh nghiệp nhỏ và tài chính khí hậu tại Việt Nam
CMG,T260713_1320,https://fireant.vn/dashboard/content/news/40876942,CMG: Đường dẫn đăng tải tài liệu họp ĐHĐCĐ TN năm 2026
HCM,T260713_0957,https://fireant.vn/dashboard/content/news/40869280,"Công ty chứng khoán chạy đua tăng vốn; chuẩn bị cho ""sân chơi"" mới"
HCM,T260713_0905,https://fireant.vn/dashboard/content/news/40866472,Lịch chốt quyền trả cổ tức trong tuần từ ngày 13/7-17/7; tỷ lệ cao nhất 50%
MSN,T260713_0848,https://fireant.vn/dashboard/content/news/40866161,Nhóm bán lẻ tiếp tục triển vọng tích cực; cổ phiếu nào tiềm năng?
TCM,T260713_0809,https://fireant.vn/dashboard/content/news/40865937,Vinatex; TNG tăng trưởng tích cực; doanh nghiệp dệt may vẫn đối mặt áp lực
PVP,T260713_0734,https://fireant.vn/dashboard/content/news/40865768,Tổng Giám đốc Petrovietnam Lê Mạnh Cường: Petrovietnam quyết tâm thực hiện mục tiêu tăng trưởng hai con số trong năm 2026
GVR,T260713_0633,https://fireant.vn/dashboard/content/news/40865640,'Đọ' thu nhập bình quân nhân viên ở Viettel; GVR; ACV; EVN: Nơi nào cao nhất?
FPT,T260712_2305,https://fireant.vn/dashboard/content/news/40865505,Góc nhìn các quỹ đầu tư về triển vọng thị trường chứng khoán
DXG,T260712_2257,https://fireant.vn/dashboard/content/news/40865493,MBS gọi tên 3 doanh nghiệp BĐS hưởng lợi nhờ phát triển hạ tầng và loạt dự án lớn
IDC,T260712_2250,https://fireant.vn/dashboard/content/news/40865478,Điều gì khiến làn sóng IPO tại Việt Nam không bùng nổ như kỳ vọng?
BVS,T260712_1528,https://fireant.vn/dashboard/content/news/40864515,Cổ phiếu tăng mạnh: Dòng tiền xoay sang penny; PNJ và VPG lao dốc
FPT,T260712_1520,https://fireant.vn/dashboard/content/news/40864500,Vinamilk; Sabeco và FPT Telecom mang về hơn 6.270 tỷ đồng cho SCIC
HHV,T260712_1231,https://fireant.vn/dashboard/content/news/40864133,Đèo Cả hưởng lợi từ làn sóng đầu tư hạ tầng
DXG,T260712_1014,https://fireant.vn/dashboard/content/news/40863787,Lợi nhuận nhóm bất động sản dân cư: Doanh nghiệp nào khởi sắc?
HHV,T260712_0959,https://fireant.vn/dashboard/content/news/40863741,Hé lộ những kết quả đầu tiên của các doanh nghiệp sau nửa năm kinh doanh
CTS,T260711_2317,https://fireant.vn/dashboard/content/news/40863118,"""Đãi cát tìm vàng"" trong giai đoạn tích lũy của thị trường chứng khoán"
HCM,T260711_2247,https://fireant.vn/dashboard/content/news/40863023,Lịch chốt quyền cổ tức 13-17/7: Cổ tức tiền mặt cao nhất 50%; một ngân hàng lớn sắp chi hơn 3.000 tỷ đồng
DXG,T260711_1513,https://fireant.vn/dashboard/content/news/40861547,Lợi nhuận nhóm bất động sản dân cư: Doanh nghiệp nào khởi sắc?
FPT,T260711_1331,https://fireant.vn/dashboard/content/news/40861170,SCIC thu hơn 8.100 tỷ đồng cổ tức; Vinamilk giữ vai trò đóng góp chủ lực
DIG,T260711_1105,https://fireant.vn/dashboard/content/news/40860656,DIG: Chủ tịch DIC Corp cùng người thân tiếp tục bị bán giải chấp cổ phiếu DIG
GVR,T260711_1019,https://fireant.vn/dashboard/content/news/40860473,Kỳ rà soát danh mục VN30: Cuộc cạnh tranh của những doanh nghiệp top đầu
GVR,T260711_0845,https://fireant.vn/dashboard/content/news/40860084,Cổ phiếu nào hưởng lợi từ thị trường carbon?
DGC,T260711_0640,https://fireant.vn/dashboard/content/news/40859680,Lỡ mua cổ phiếu dính 'biến cố': Cắt lỗ ngay hay chờ cú hồi?
SZC,T260710_1819,https://fireant.vn/dashboard/content/news/40857920,SZC: Báo cáo kết quả giao dịch cổ phiếu của người nội bộ Phạm Anh Tuấn
BSI,T260710_1816,https://fireant.vn/dashboard/content/news/40857838,BSI: Thông báo nhận được Quyết định của HOSE về việc chấp thuận thay đổi đăng ký niêm yết cho BSI
NKG,T260710_1814,https://fireant.vn/dashboard/content/news/40857842,NKG: Giấy chứng nhận đăng ký doanh nghiệp thay đổi lần thứ 33
NHA,T260710_1800,https://fireant.vn/dashboard/content/news/40857748,NHA: Thông báo về ngày đăng ký cuối cùng trả cổ tức năm 2025 bằng cổ phiếu
CTS,T260710_1756,https://fireant.vn/dashboard/content/news/40857673,CTS: Thông báo nhận được công văn của VSDC về việc điều chỉnh thông tin số lượng chứng khoán đăng ký
NLG,T260710_1744,https://fireant.vn/dashboard/content/news/40857616,NLG: Nghị quyết HĐQT về việc phê duyệt giao dịch với bên có liên quan
DIG,T260710_1733,https://fireant.vn/dashboard/content/news/40857514,DIG: Báo cáo kết quả giao dịch cổ phiếu của Người nội bộ Nguyễn Thị Thanh Huyền; Nguyễn Hùng Cường
DIG,T260710_1733,https://fireant.vn/dashboard/content/news/40857515,DIG: Báo cáo kết quả giao dịch cổ phiếu của người có liên quan đến Người nội bộ Lê Thị Hà Thành
PVP,T260710_1614,https://fireant.vn/dashboard/content/news/40856645,NÓNG!!! 6 tháng đầu năm; Petrovietnam nộp ngân sách Nhà nước gần 89 nghìn tỉ đồng
HDC,T260710_1349,https://fireant.vn/dashboard/content/news/40851216,HDC: Quyết định thay đổi đăng ký niêm yết
EIB,T260710_1206,https://fireant.vn/dashboard/content/news/40847486,"Cơ hội giải ngân ""cổ phiếu vua"""
NKG,T260710_0910,https://fireant.vn/dashboard/content/news/40838767,NKG: Thông báo về việc giao dịch chứng khoán thay đổi đăng ký niêm yết
MSN,T260709_2335,https://fireant.vn/dashboard/content/news/40837082,3 ETF ngoại nắm hơn 1;3 tỷ USD cổ phiếu Việt Nam: Fubon ETF hiệu suất tốt nhất lại bị rút vốn mạnh nhất
HDG,T260709_2319,https://fireant.vn/dashboard/content/news/40837048,Cập nhật KQKD quý 2/2026 ngày 10/7: BSR lãi gấp 5 lần cùng kỳ; một ngân hàng báo lãi 6 tháng tăng 80%
MSN,T260709_2249,https://fireant.vn/dashboard/content/news/40836962,SSI gọi tên 8 doanh nghiệp đáng chú ý trong nửa cuối năm
SSB,T260709_1830,https://fireant.vn/dashboard/content/news/40835566,SSB: Thông báo giao dịch cổ phiếu của người nội bộ Nguyễn Tuấn Anh
HHV,T260709_1820,https://fireant.vn/dashboard/content/news/40835420,Chốt quyền ngày 9/7/2026: Công trình Viettel cùng nhiều doanh nghiệp chia cổ tức cho cổ đông
FTS,T260709_1817,https://fireant.vn/dashboard/content/news/40835404,FTS: Giấy chứng nhận đăng ký doanh nghiệp thay đổi lần thứ 8
HDC,T260709_1814,https://fireant.vn/dashboard/content/news/40835411,HDC: Giấy chứng nhận đăng ký doanh nghiệp thay đổi lần thứ 34
HDC,T260709_1813,https://fireant.vn/dashboard/content/news/40835390,HDC: Thông báo Điều lệ tổ chức và hoạt động của Công ty
BSI,T260709_1719,https://fireant.vn/dashboard/content/news/40835076,BSI: Quyết định HĐQT số 358 ngày 09/07/2026
HT1,T260709_1712,https://fireant.vn/dashboard/content/news/40834996,HT1: Quyết định của HĐQT về việc chấp thuận chủ trương giao dịch với Công ty Cổ phần Logistics VICEM
BSI,T260709_0957,https://fireant.vn/dashboard/content/news/40821913,BSI: Quyết định về việc thay đổi đăng ký niêm yết
DGC,T260709_0749,https://fireant.vn/dashboard/content/news/40818607,Ra khỏi nhóm vốn hóa 1 tỉ USD; nhiều cổ phiếu chưa 'hẹn' ngày trở lại
HDG,T260708_2356,https://fireant.vn/dashboard/content/news/40818218,Nắng nóng kích hoạt mùa báo lãi; lợi nhuận ngành điện vẫn khó duy trì mức cao
NVL,T260708_1722,https://fireant.vn/dashboard/content/news/40815913,NVL: Giấy chứng nhận đăng ký doanh nghiệp thay đổi lần thứ 76
CTS,T260708_1415,https://fireant.vn/dashboard/content/news/40812285,CTS: CBTT Giấy chứng nhận thu hồi con dấu của địa điểm kiinh doanh - Phòng GD Bà Triệu
DBC,T260708_0909,https://fireant.vn/dashboard/content/news/40799311,Khuyến nghị cổ phiếu DBC và DPR: Kỳ vọng gì trong năm 2026?
VCI,T260707_2015,https://fireant.vn/dashboard/content/news/40795517,Cạnh tranh khốc liệt; chia sẻ thị phần môi giới chứng khoán top đầu
BCM,T260707_1902,https://fireant.vn/dashboard/content/news/40794946,BCM: Becamex rót gần 695 tỷ đồng lập công ty con tại Khánh Hòa
NVL,T260707_1436,https://fireant.vn/dashboard/content/news/40791031,NVL: Báo cáo tiến độ sử dụng số tiền thu được từ đợt phát hành CP theo chương trình lựa chọn cho NLĐ
BCM,T260707_1433,https://fireant.vn/dashboard/content/news/40791026,BCM: Nghị quyết HĐQT phê duyệt chủ trương thành lập Công ty con
TCM,T260707_1425,https://fireant.vn/dashboard/content/news/40790332,TCM: Lợi nhuận Dệt may Thành Công giảm mạnh
NVL,T260707_1422,https://fireant.vn/dashboard/content/news/40790476,NVL: Thông báo về việc giao dịch chứng khoán thay đổi đăng ký niêm yết
HT1,T260707_1411,https://fireant.vn/dashboard/content/news/40789741,HT1: Thông báo ký hợp đồng kiểm toán BCTC 2026
NKG,T260707_1116,https://fireant.vn/dashboard/content/news/40783896,Dự báo lợi nhuận quý II/2026: Doanh nghiệp nào được kỳ vọng bứt phá?
BVS,T260707_1009,https://fireant.vn/dashboard/content/news/40780460,Nhận định cổ phiếu 7/7: Khuyến nghị mua BVS; HPG và VEA
DGC,T260707_0935,https://fireant.vn/dashboard/content/news/40778740,DGC: Hóa chất Đức Giang lên lộ trình khắc phục tình trạng chứng khoán bị cảnh báo
HT1,T260707_0002,https://fireant.vn/dashboard/content/news/40775786,Vietcap dự báo VN-Index có cơ hội trở lại đỉnh cũ; gọi tên 4 cổ phiếu tiềm năng
VCI,T260706_2246,https://fireant.vn/dashboard/content/news/40775556,"Dự báo lợi nhuận quý 2 của 57 doanh nghiệp ""hot"": Hai cái tên có thể tăng trưởng trên 700%"
EIB,T260706_1747,https://fireant.vn/dashboard/content/news/40773151,Hai ngân hàng chuẩn bị họp cổ đông bất thường bàn vấn đề nhân sự
CMG,T260706_1722,https://fireant.vn/dashboard/content/news/40772943,CMG: Thông báo thư mời họp ĐHĐCĐ thường niên năm 2026 kèm Giấy ủy quyền tham dự
NHA,T260706_1336,https://fireant.vn/dashboard/content/news/40764911,NHA: Thông báo phát hành CP để trả cổ tức năm 2025
NHA,T260706_1335,https://fireant.vn/dashboard/content/news/40764912,NHA: Nghị quyết HĐQT số 10 ngày 03/07/2026
VGC,T260706_0936,https://fireant.vn/dashboard/content/news/40756544,VGC: Một mảng 'đặc biệt' vừa có lãi trở lại sau 3 năm thua lỗ; đón ngay tin vui từ quyết định áp thuế chống bán phá giá của Bộ Công Thương
EIB,T260705_1816,https://fireant.vn/dashboard/content/news/40753413,Eximbank chuẩn bị họp ĐHCĐ bất thường: Thay loạt thành viên HĐQT; yêu cầu không truyền tin ra ngoài cho đến khi có kết luận cuộc họp
BVS,T260705_1106,https://fireant.vn/dashboard/content/news/40752507,Cổ phiếu chứng khoán hút dòng tiền: Định giá về vùng hấp dẫn; lực kéo từ thanh khoản tỷ USD
VDS,T260704_2212,https://fireant.vn/dashboard/content/news/40751687,Soi định giá cổ phiếu chứng khoán khi đồng loạt bứt phá: Bất ngờ với SSI; SHS; VCI
VGC,T260704_1405,https://fireant.vn/dashboard/content/news/40750388,GEX: Bị phạt 175 triệu đồng vì công bố thông tin sai lệch về sử dụng vốn trái phiếu
FTS,T260703_1847,https://fireant.vn/dashboard/content/news/40747143,FTS: Thông báo về việc giao dịch chứng khoán thay đổi đăng ký niêm yết
BCM,T260703_1003,https://fireant.vn/dashboard/content/news/40732554,Trong chu kỳ phát triển mới; doanh nghiệp bất động sản khu công nghiệp làm ăn ra sao?
PVP,T260702_0736,https://fireant.vn/dashboard/content/news/40711071,PVT: PVTrans phát hành Báo cáo phát thải khí nhà kính năm 2025
VDS,T260701_1733,https://fireant.vn/dashboard/content/news/40708571,VDS: Thông báo ký hợp đồng kiểm toán BCTC 2026
DBC,T260701_1724,https://fireant.vn/dashboard/content/news/40708523,DBC: Báo cáo tiến độ sử dụng vốn
SZC,T260701_0923,https://fireant.vn/dashboard/content/news/40695049,Ngành nào sẽ dẫn dắt tăng trưởng lợi nhuận quý II?
IDC,T260630_1712,https://fireant.vn/dashboard/content/news/40691045,IDC: Ngày đăng ký cuối cùng trả cổ tức bằng tiền mặt; trả cổ tức bằng cổ phiếu cho cổ đông hiện hữu
CMG,T260630_0914,https://fireant.vn/dashboard/content/news/40677198,CMG: Giải trình biến động BCTC kiểm toán năm 2025
TCM,T260629_1641,https://fireant.vn/dashboard/content/news/40673329,TCM: Giấy chứng nhận đăng ký doanh nghiệp thay đổi lần thứ 28
IJC,T260629_1629,https://fireant.vn/dashboard/content/news/40673191,IJC: Nghị quyết HĐQT số 28 ngày 26/06/2026
IJC,T260629_1442,https://fireant.vn/dashboard/content/news/40671515,IJC: Duyệt dự án chung cư 2.328 tỷ đồng; kỳ vọng thu về gần 443 tỷ đồng lợi nhuận
IJC,T260622_1334,https://fireant.vn/dashboard/content/news/40561503,IJC: Nghị quyết HĐQT số 26 ngày 18/06/2026
